{
  "id": "ISSUE-013",
  "grade": "drift",
  "layer": "gate",
  "domain": "harness-core",
  "core": false,
  "core_nodes": [
    "context-compact",
    "context-view"
  ],
  "basis": [
    "A7"
  ],
  "title": "Death-list g2 asserts Compact→reload via source substrings (fragile gate)",
  "promise": "session_seq_g2_pipeline_reloads_fold_not_summary_plus_kept guards fold reload after Compact",
  "actual": "WP-015 rewrite landed: g2 is item-level (compact_transcript body: SessionMutation::Compact → working_set_blocking) + thin dialect ban (checkpoint_seq(), old pi-view comment) across context_pipeline; compact_llm_path uses item-level check on call_llm_compact_with_timeout for complete_with_stream_events (no whole-file must-contain) and keeps forbidden-token dialect bans. Behavior: working_set_identity::keep_recent_compact_reader_matches_fold_checkpoint_then_kept, stage_a::pipeline_compact_reloads_working_set_from_fold, compact.rs CountingProvider call-count on unified stream entry.",
  "evidence": [
    {
      "path": "src/types/death_list_gate.rs",
      "symbol": "fn session_seq_g2_pipeline_reloads_fold_not_summary_plus_kept",
      "commit": "075308b"
    },
    {
      "path": "src/context_pipeline/compact.rs",
      "symbol": "impl CompactPolicy › fn compact_transcript",
      "commit": "075308b"
    }
  ],
  "repro": "Read death_list_gate g2; compare to compact_transcript reload path.",
  "reporter": "context",
  "owner": "context",
  "status": "closed",
  "blocks": false,
  "history": [
    {
      "ts": "2026-10-12T00:30:00+08:00",
      "by": "context",
      "change": "Batch3 from DRAFT-CTX-003"
    },
    {
      "ts": "2026-10-12T00:40:00+08:00",
      "by": "runtime",
      "change": "restored JSON after accidental ISSUE-013 overwrite; content from context artifact"
    },
    {
      "ts": "2026-10-12T00:30:24+08:00",
      "by": "context",
      "change": "GM authorized schedule: rewrite g2 gate from source-substring asserts to symbol/behavior test. Keep open until rewrite lands. Deleting or loosening the death-list entry still requires an issue-recorded reason; no silent green."
    },
    {
      "ts": "2026-10-12T11:34:39+08:00",
      "by": "demand_officer",
      "change": "WP-012: 确认仍 open；拟把 g2 + compact_llm_path 子串门一并改写为符号/行为测；禁静默删"
    },
    {
      "ts": "2026-10-12T11:54:00+08:00",
      "by": "context",
      "change": "WP-015 / ISSUE-013: rewrote fragile substring gates → symbol/behavior. Removed whole-file asserts compact.contains(\"complete_with_stream_events\") and adjacency-only working_set_blocking / \"Align in-memory…\" / checkpoint_seq() file-level contains. Added: fn_item_body helper; session_seq_g2_pipeline_reloads_fold_not_summary_plus_kept (item-level compact_transcript + dialect scan); compact_llm_path_does_not_bypass_unified_provider (item-level call_llm_compact_with_timeout + kept dialect bans); stage_a pipeline_compact_reloads_working_set_from_fold; compact.rs CountingProvider asserts complete_with_stream_events call count. Product invariants still gated. Suggest status=closed."
    },
    {
      "ts": "2026-10-12T12:15:42+08:00",
      "by": "demand_officer",
      "change": "WP-015: 上下文改写 g2+compact_llm 为符号/行为测并加 stage_a 行为测；cargo 相关绿；closed（未 commit）"
    }
  ]
}
